ID,Topic No.,Topic Name,Q.No,Question,Q.Image,A,A.Image,B,B.Image,C,C.Image,D,D.Image,Answer
313,6, Vulnerable road users,59,You're driving in a slow-moving queue of traffic. What should you do just before changing lane?,no,Sound the horn and flash your lights,no,Look for motorcyclists filtering through the traffic,no,Give a 'slowing down' arm signal,no,Change down to first gear,no,B
314,6, Vulnerable road users,60,You're driving in town. Why should you be careful if there's a bus at a bus stop on the other side of the road?,no,The bus might have broken down,no,Pedestrians might come from behind the bus,no,The bus might move off suddenly,no,The bus might remain stationary,no,B
315,6, Vulnerable road users,61,How should you overtake horse riders?,no,Drive up close and overtake as soon as possible,no,Speed isn't important but allow plenty of room,no,Use your horn just once to warn them,no,Drive slowly and leave plenty of room,no,D
316,6, Vulnerable road users,62,Why should you allow extra room while overtaking a motorcyclist on a windy day?,no,The rider may turn off suddenly to get out of the wind,no,The rider may be blown in front of you,no,The rider may stop suddenly,no,The rider may be travelling faster than normal,no,B
317,6, Vulnerable road users,63,Where should you take particular care to look for motorcyclists and cyclists?,no,On dual carriageways,no,At junctions,no,At zebra crossings,no,On one-way streers,no,B
318,6, Vulnerable road users,64,The road outside this school is marked with yellow zigzag lines. What do these lines mean?,yes,You may park on the lines when dropping off schoolchildren,no,You may park on the lines when picking up schoolchildren,no,You shouldn't wait or park your vehicle here,no,You must stay with your vehicle if you park here,no,C
319,6, Vulnerable road users,65,You're driving past parked cars. What should you do if you see a bicycle wheel sticking out between the cars?,no,Accelerate past quickly and sound your horn,no,Slow down and wave the cyclist across,no,Brake sharply and flash your headlights,no,Slow down and be prepared to stop for a cyclist,no,D
320,6, Vulnerable road users,66,You're driving at night. What should you do if you're dazzled by a vehicle behind you?,no,Set your mirror to the anti-dazzle position,no,Set your mirror to dazzle the other driver,no,Brake sharply to a stop,no,Switch your rear lights on and off,no,A
321,6, Vulnerable road users,67,You're driving towards a zebra crossing. What should you do if a person in a wheelchair is waiting to cross?,no,Continue on your way,no,Wave to the person to cross,no,Wave to the person to wait,no,Be prepared to stop,no,D
322,6, Vulnerable road users,68,You're turning right from a main road into a side road. There's no oncoming traffic. What should you do if pedestrians are standing on the pavement waiting to cross the side road?,no,Turn in because the pedestrians are safe on the pavement,no,"Wave at the pedestrians, inviting them to cross the road",no,Wait and give way to the pedestrians,no,Sound your horn to alert the pedestrians to your presence,no,C
323,6, Vulnerable road users,69,You're travelling on a narrow section of road. What should you do if a horse rider ahead is riding in the centre of the lane?,no,Sound your horn to alert them to your presence,no,Stay behind and allow them to ride in this position,no,Move across to the right and try to ease past them,no,Get up close behind to encourage them to move aside,no,B
324,6, Vulnerable road users,70,You're about to overtake a cyclist on a road that has a 30 mph speed limit. How much room should you leave them as you overtake?,no,At least as much room as you would if you were overtaking a car,no,At least a car's width,no,At least a car's length,no,At least 2 car widths,no,A
325,6, Vulnerable road users,71,You're turning left from amain road into a side road. What should you do if there's a pedestrian on the pavement waiting to cross the side road?,no,Flash your lights to encourage the pedestrian to cross,no,Carry on turning into the side road,no,Sound your horn to let the pedestrian know you're there,no,Wait and give way to the pedestrian,no,D
326,7,Other types of vehicle,1,You're about to overtake a slow-moving motorcyclist. Which sign would make you take sppecial care?,no,,yes,,yes,,yes,,yes,A
327,7,Other types of vehicle,2,"You're waiting to turn right out of a minor road. It's clear to the left but a lorry is coming from the right. Why should you wait, even if you have enough time to turn?",no,Anything overtaking the lorry will be hidden from view,no,The lorry could suddenly speed up,no,The lorry might be slowing down,no,The load on the lorry might be unstable,no,A
328,7,Other types of vehicle,3,You're following a long vehicle as it approaches a crossroads. What should you do if it signals left but moves out to the right?,yes,Get closer in order to pass it quickly,no,Stay well back and give it room,no,Assume the signal is wrong and that it's turning right,no,Overtake it as it starts to slow down,no,B
329,7,Other types of vehicle,4,You're following love vehicle approaching a crossroads. What should you do if the driver signals right but moves close to the left-hand kerb?,yes,Warn the driver about the wrong signal,no,Wait behind the long vehicle,no,Report the driver to the police,no,Overtake on the right-hand side,no,B
330,7,Other types of vehicle,5,You're approaching a mini-roundabout. What should you do if a long vehicle in front signals left but positions over to the right?,yes,Sound your horn,no,Overtake on the left,no,Follow the same course as the lorry,no,Keep well back,no,D
331,7,Other types of vehicle,6,You're driving on a single carriageway road. Why should you keep well back while you're following a large vehicle?,no,To give yourself acceleration space if you decide to overtake,no,To get the best view of the road ahead,no,To leave a gap in case the vehicle stops and rolls back,no,To offer other drivers a safe gap if they want to overtake you,no,B
332,7,Other types of vehicle,7,You're travelling behind a bus. What should you do if it pulls up at a bus stop?,no,Accelerate past the bus,no,Look for pedestrians,no,Sound your horn,no,Pull in closely behind the bus,no,B
333,7,Other types of vehicle,8,You're following a lorry on a wet road. What should you do when spray makes it difficult to see the road ahead?,yes,Drop back untill you can see better,no,Put your headlights on full beam,no,"Keep close to the lorry, away from the spray",no,Speed up and overtake quickly,no,A
334,7,Other types of vehicle,9,You're leaving a safe gap as you follow a large vehicle. What should you do if a car moves into this gap?,no,Sound your horn,no,Drop back further,no,Flash your headlights,no,Start to overtake,no,B
335,7,Other types of vehicle,10,What should you do when you're approaching a bus that's signalling to move away from a bus stop?,yes,Get past before it moves,no,"Allow it to pull away, if it's safe to do so",no,Flash you headlights as you approach,no,Signal left and wave tho bus on,no,B
336,7,Other types of vehicle,11,"What should you do if you want to overtake a long, slow-moving vehicle on a busy road?",no,Follow it closely and keep moving out to see the road ahead,no,Flash your headlights for the oncoming traffic to give way,no,Stay behind until the driver waves you past,no,Keep well back so that you get a good view of the road ahead,no,D
337,7,Other types of vehicle,12,Which vehicles are least likely to be affected by side wind?,no,Cyclists,no,Motorcyclists,no,High-sided vehicles,no,Cars,no,D
338,7,Other types of vehicle,13,What should you do as you approach this lorry?,yes,Slow down and be prepared to wait,no,Make the lorry wait for you,no,flash your lights at the lorry,no,Move to the right-hand side of the road,no,A
339,7,Other types of vehicle,14,You're following a large vehicle as it approaches a crossroads. What should you do if the driver signals to turn left?,no,ovetake if you can leave plenty of room,no,Over if there are no oncoming vehicles,no,Wait for the driver to cancel his signal,no,Wait for the vehicle to finish turning,no,D
340,7,Other types of vehicle,15,Why is it more difficult to overtake a large vehicle than a car?,no,It will take longer to overtake a large vehicle,no,A large vehicle will be fitted with a speed limiter,no,A large vehicle will have air brakes,no,It will take longer for a large vehicle to accelerate,no,A
341,7,Other types of vehicle,16,It's very windy. What should you do if you're behind a motocyclist who's overtaking a high-sided vehicle?,no,Overtake the motorcyclist immediately,no,Keep well back,no,Stay level with tho morocysclist,no,Keep choose to the motorcyclist,no,B
342,7,Other types of vehicle,17,What should you do if there's a bus at a bus stop ahead of you?,no,Flash your lights to warn the driver of your presence,no,Continue at the same speed but sound your horn as a warning,no,Watch carefully for the sudden appearance of pedestrians,no,Pass the bus as quickly as you possibly can,no,C
343,7,Other types of vehicle,18,What should you be prepared to do in this situation?,yes,Sound your horn and continue,no,Slow down and give way,no,Report the driver to the police,no,Squeeze through the gap,no,B
344,7,Other types of vehicle,19,Why should drivers be more careful on roads where trams also operate?,no,Because trams don't have a horn,no,Because trams can't stop for cars,no,Because trams don't have lights,no,Because trams can't steer to avoid obstructions,no,D
345,7,Other types of vehicle,20,You're towing a caravan. Which is the safest type of rear-view mirror to use?,no,Interior wide-angle mirror,no,Extended-arm side mirrors,no,Ordinary door mirrors,no,Ordinary interior mirror,no,B
346,7,Other types of vehicle,21,You're driving in heavy traffic on a wet road. Which lights should you use if there's a lot of surface spray?,no,Main-beam headlights,no,Sidelights only,no,Rear fog lights if visibility is more than 100 metres (328 feet),no,Dipped headlights,no,D
347,7,Other types of vehicle,22,What should you do if you overtake a cyclist when it's very windy?,no,Overtake very slowly,no,Keep close as you pass,no,Sound your horn repeatedly,no,Allow extra room,no,D
348,8,Vehicle handling,1,When may you overtake another vehicle on their left?,no,When you're in a one-way street,no,When approaching a motorway slip road where you'll be turning off,no,When the vehicle in front is signalling to turn left,no,When a slower vehicle is travelling in the right-hand lane of a dual carriageway,no,A
349,8,Vehicle handling,2,You're travelling in very heavy rain. How is this likely to affect your overall stopping distance?,no,It will be doubled,no,It will be halved,no,It will be ten times greater,no,It will be no different,no,A
350,8,Vehicle handling,3,What should you do when you're overtaking at night?,no,Wait until a bend so that you can see oncoming headlights,no,Sound your horn twice before moving out,no,Go past slowly so that you can react to unseen hazards,no,Beware of bends in the road ahead,no,D
351,8,Vehicle handling,4,When may you wait in a box junction?,yes,When you're stationary in a queue of traffic,no,When approaching a pelican crossing,no,When approaching a zebra crossing,no,When oncoming traffic prevents you turning right,no,D
352,8,Vehicle handling,5,Which plate may appear with this road sign?,yes,,yes,,yes,,yes,,yes,A
353,8,Vehicle handling,6,What's the reason for traffic-calming measures?,no,To stop road age,no,To make overtaking easier,no,To slow traffic down,no,To make parking easier,no,C
354,8,Vehicle handling,7,What colour are the reflective studs along the left-hand edge of the motorway?,yes,Green,no,Amber,no,Red,no,White,no,C
355,8,Vehicle handling,8,What's a rumble device designed to do?,yes,Give directions,no,Prevent cattle escaping,no,Alert you to low tyre pressure,no,Alert you to a hazard,no,D
356,8,Vehicle handling,9,What should you do if you have to make a journey in foggy conditions?,no,Follow other vehicles' tail lights closely,no,Avoid using dipped headlights,no,Leave plenty of time for your journey,no,Keep two seconds behind the vehicle ahead,no,C
357,8,Vehicle handling,10,What must you do when you're overtaking a car at night?,no,Flash your headlights before overtaking,no,Select a higher gear,no,Switch your headlights to main beam before overtaking,no,Make sure you don't dazzle other road users,no,D
358,8,Vehicle handling,11,You're travelling on a road that has road humps. What should you do when the driver in front I travelling more slowly than you?,yes,Sound your horn,no,Overtake as soon as you can,no,Flash your headlights,no,Slow down and stay behind,no,D
359,8,Vehicle handling,12,What's the purpose of the yellow lines painted across the road?,yes,To show a safe distance between vehicles,no,To keep the area clear of traffic,no,To make you aware of your speed,no,To warn you to change direction,no,C
360,8,Vehicle handling,13,What should you do when you meet an oncoming vehicle on a single-track road?,no,Reverse back to the main road,no,Carry out an emergency stop,no,Stop at a passing place,no,Switch on your hazard warning lights,no,C
361,8,Vehicle handling,14,The road is wet. Why would a motorcyclist steer around drain covers while they were cornering?,no,To avoid puncturing the typres on the edge of the drain covers,no,To prevent the motorcycle sliding on the metal drain covers,no,To help judge the bend using the drain covers as marker points,no,To avoid splashing pedestrians on the pavement,no,B
362,8,Vehicle handling,15,Why should you test your brakes after this hazard?,yes,You'll be on a slippery road,no,Your brakes will be wet,no,You''ll be going down a long hill,no,You'll have just crossed a long bridge,no,B
363,8,Vehicle handling,16,Why should you reduce your speed when you're driving or riding in fog?,no,The brakes don't work as well,no,You'll be dazzled by other headlights,no,The engine will take longer to warm up,no,It's more difficult to see what's ahead,no,D
364,8,Vehicle handling,17,What will happen to your car when you drive up steep hill?,no,The high gears will pull better,no,The steering will feel heavier,no,Overtaking will be easier,no,The engine will work harder,no,D
365,8,Vehicle handling,18,You're driving on the motorway in windy conditions. What should you do as you overtake a high-sided vehicle?,no,Increase your speed,no,Be wary of a sudden gust,no,Drive alongside very closely,no,Expect normal conditions,no,B
366,8,Vehicle handling,19,You're driving in fog. Why should you keep well back from the vehicle in front?,no,In case it changes direction suddenly,no,In case its fog lights dazzle you,no,In case it stops suddenly,no,In case its brake lights dazzle you,no,C
367,8,Vehicle handling,20,What should you do if you park in the road when it's foggy?,no,Leave parking lights switched on,no,Leave dipped headlights and fog lights switched on,no,Leave dipped headlights switched on,no,Leave main-beam headlights switched on,no,A
368,8,Vehicle handling,21,You're driving at night. What should you do if you're dazzled by headlights coming towards you?,no,Pull down your sun visor,no,Slow down or stop,no,Flash your main-beam headlights,no,Shade your eyes with your hand,no,B
369,8,Vehicle handling,22,When may front fog lights be used?,yes,When visibility is seriously reduced,no,When they're fitted above the bumper,no,When they aren't as bright as the headlights,no,When an audible warning device is used,no,A
370,8,Vehicle handling,23,You're driving with your front fog lights switched on. What should you do if the fog has cleared?,yes,Leave them on if other drivers have their lights on,no,Switch them off as long as visibility remains good,no,Flash them to warn oncoming traffic that it's foggy,no,Drive wth them on instead of your headlights,no,B
371,8,Vehicle handling,24,Why should you switch off your rear fog lights when the fog has cleared?,no,To allow your headlights to work,no,To stop draining the battery,no,To stop the engine losing power,no,To prevent dazzling drivers behind,no,D
372,8,Vehicle handling,25,What will happen if you use rear fog lights in good conditions?,no,They'll make it safer when towing a trailer,no,They'll protect you from larger vehicles,no,They'll dazzle other drivers,no,They'll make drivers behind keep back,no,C
373,8,Vehicle handling,26,Why would you fit chains to your wheels?,no,To help prevent damage to the road surface,no,To help prevent wear to the tyres,no,To help prevent skidding in deep snow,no,To help prevent the brakes locking,no,C
374,8,Vehicle handling,27,How can you use your vehicle's engine to control your speed?,no,By changing to a lower gear,no,Be selecting reverse gear,no,By changing to a higher gear,no,By selecting neutral,no,A
375,8,Vehicle handling,28,"Why could it be dangerous to keep the clutch down, or select neutral, for long periods of time while you're driving?",no,Fuel spillage will occur,no,Engine damage may be caused,no,You'll have less steering and braking control,no,It will wear tyres out more quickly,no,C
376,8,Vehicle handling,29,You're driving on an icy road. What distance from the car in front should you drive?,no,Four times the normal distance,no,Six times the normal distance,no,Eight times the normal distance,no,Ten times the normal distance,no,D
377,8,Vehicle handling,30,Which lights must you use if you're driving on a well-lit motorway at night?,no,Use only your sidelights,no,Use your headlights,no,Use rear fog lights,no,Use front fog lights,no,B
378,8,Vehicle handling,31,You're driving on a motorway at night. Which lights should you have on if there are other vehicles just ahead of you?,no,Front fog lights,no,Main-beam headlights,no,Sidelights only,no,Dipped headlights,no,D
379,8,Vehicle handling,32,What will affect your vehicle's stopping distance?,no,The speed limit,no,The street lighting,no,The time of day,no,The condition of the tyres,no,D
380,8,Vehicle handling,33,When will you feel the effects of engine braking?,no,When you only use the parking brake,no,When you're in neutral,no,When you change to a lower gear,no,When you change to a higher gear,no,C
381,8,Vehicle handling,34,Which lights should you switch on when daytime visibility is poor but not seriously reduced?,no,Headlights and fog lights,no,Front fog lights,no,Dipped headlights,no,Rear fog lights,no,C
382,8,Vehicle handling,35,Why are vehicles fitted with rear fog lights?,no,To make them more visible when driving at high speed,no,To show when they've broken down in a dangerous position,no,To make them more visible in thick fog,no,To warn drivers following closely to drop back,no,C
383,8,Vehicle handling,36,There's been a heavy fall of snow. What should you consider before driving in these conditions?,no,Whether you should fit an amber flashing beacon to your car,no,Whether you should drive without wearing your seat belt,no,Whether you should wear sunglasses to reduce the glare,no,Whether your journey is essential,no,D
384,8,Vehicle handling,37,What should you check before you start a journey in foggy weather?,no,The radiator has enough anti-freeze,no,You have a warning triangle in the vehicle,no,The windows and lights are clean and clear,no,You have a mobile phone with you,no,C
385,8,Vehicle handling,38,You've been driving in fog. What must you do when the visibility improves?,no,Switch off your fog lights,no,Keep your rear fog lights switched on,no,Keep your front fog lights switched on,no,Leave your fog lights switched on in case the fog returns,no,A
386,8,Vehicle handling,39,Why is it dangerous to leave rear fog lights switched on after the fog has cleared?,no,They may be confused with brake lights,no,The bulbs would fail,no,Electrical systems could be overloaded,no,Direction indicators may not work properly,no,A
387,8,Vehicle handling,40,What will happen if you hold the clutch pedal down or roll in neutral for too long?,no,It will use more fuel,no,It wll cause the engine to overheat,no,It will reduce your control,no,It will improve tyre wear,no,C
388,8,Vehicle handling,41,Why is it bad technique to coast when you're driving downhill?,no,The fuel consumption will increase,no,The engine will overheat,no,The tyres will wear more quickly,no,The vehicle will gain speed more quickly,no,D
389,8,Vehicle handling,42,What should you do when dealing with this hazard?,yes,Switch on your hazard warning lights,no,Use a low gear and drive slowly,no,Use a high gear to prevent wheelspin,no,Switch on your windscreen wipers,no,B
390,8,Vehicle handling,43,Why is travelling in neutral for long distances (known as coasting) bad driving technique?,no,It will cause the car to skid,no,It will make the engine stall,no,The engine will run faster,no,There won't be any engine braking,no,D
391,8,Vehicle handling,44,When must you use dipped headlights during the day?,no,All the time you're driving,no,When you're driving along narrow streets,no,When you're driving in poor visibility,no,When you're parking,no,C
392,9,Motorway rules,1,You're joining a motorway from a slip road. How should you deal with traffic already on the motorway?,no,Carry on along the hard shoulder until you see a safe gap,no,Stop at the end of the slip road and look for a safe gap,no,Use the slip road to accelerate until you're moving much faster than the motorway traffic,no,Match your speed to traffic in the left-hand lane and filter into a safe gap,no,D
393,9,Motorway rules,2,What's the national speed limit on motorways for cars and motorcycles?,no,30 mph,no,50 mph,no,60 mph,no,70 mph,no,D
394,9,Motorway rules,3,Which vehicles should use the left-hand lane on a three-lane motorway?,yes,Any vehicle that isn't overtaking,no,Large vehicles only,no,Emergency vehicles only,no,Slow vehicles only,no,A
395,9,Motorway rules,4,Which vehicles aren't allowed to use the right-hand lane of a three-lane motorway?,no,Small delivery vans,no,Motorcycles,no,Vehicles towing a trailer,no,Motorcycle and sidecar outfits,no,C
396,9,Motorway rules,5,Your vehicle breaks down on a motorway and you need to call for help. Why might it be better to use an emergency roadside telephone rather than a mobile phone?,no,It connects you to a local garage,no,Using a mobile phone will distract other drivers,no,It allows easy location by the emergency services,no,Mobile phones don't work on motorways,no,C
397,9,Motorway rules,6,"Your vehicle broke down on the hard shoulder of a motorway, but has now been repaired. How should you rejoin the main carriageway?",no,"Move out onto the carriagewa, then build up your speed",no,Move out onto the carriafeway using your hazard warning lights,no,Gain speed on the hard shoulder before moving out onto the carriageway,no,Wait on the hard shoulder until someone flashes their headlights at you,no,C
398,9,Motorway rules,7,You're travelling along a motorway. Where would you find a crawler or climbing lane?,yes,On a steep gradient,no,Before a service area,no,Before a junction,no,Along the hard shoulder,no,A
399,9,Motorway rules,8,What do these motorway signs mean?,yes,They're countdown markers to a bridge,no,They're distance markers to the next telephone,no,They're countdown markers to the next exit,no,They want of a police control ahead,no,C
400,9,Motorway rules,9,Where are amber reflective studs found on a motorway?,no,Between the hard shoulder and the carriageway,no,Between the acceleration lane and the carriageway,no,Between the central reservation and the carriageway,no,Between each pair of lanes,no,C
401,9,Motorway rules,10,What colour are the reflective studs between the lanes on a motorway?,yes,Green,no,Amber,no,White,no,Red,no,C
402,9,Motorway rules,11,What colour are the reflective studs between a motorway and a slip road?,no,Amber,no,White,no,Green,no,Red,no,C
403,9,Motorway rules,12,Your vehicle has broken down on a motorway. In which direction should you walk to find the nearest emergency telephone?,no,With the traffic flow,no,Facing oncoming traffic,no,In the direction shown on the marker posts,no,In the direction of the nearest exit,no,C
404,9,Motorway rules,13,Why is it important to make full use of the slip road as you join a motorway?,no,Because there's space available to turn round if you need to,no,To allow you direct access to the overtaking lanes,no,To allow you to fit safely into the traffic flow in the left-hand lane,no,Because you can continue on the hard shoulder,no,C
405,9,Motorway rules,14,How should you position yourself when you use the emergency telephone on a motorway?,no,Stay close to the carriageway,no,Face the oncoming traffic,no,Keep your back to the traffic,no,Stand on the hard shoulder,no,B
406,9,Motorway rules,15,What colour are the reflective studs between the hard shoulder and the left-hane lane of a motorway?,no,Green,no,Red,no,White,no,Amber,no,B
407,9,Motorway rules,16,"On a three-lane motorway, which lane shoulde you use if there's no traffic ahead?",no,Left,no,Right,no,Centre,no,Either the right or centre,no,A
408,9,Motorway rules,17,What should you do when going through a contraflow system on a motorway?,yes,Use dipped headlights,no,Keep a good distance from the vehicle ahead,no,Switch lanes to keep the traffic flowring,no,Stay close to the vehicle ahead to reduce queues,no,B
409,9,Motorway rules,18,You're on a three-lane motorway. Which lane are you in if there are red reflective studs on your left and white ones to your right?,yes,In the right-hand lane,no,In the middle lane,no,On the hard shoulder,no,In the left-hand lane,no,D
410,9,Motorway rules,19,What should you do when you're approaching roadwork on a motorway?,no,Speed up to clear the area wuickly,no,Always use the hard shoulder,no,Obey the speed limit,no,Stay very close to the vehicle in front,no,C
