ID,Topic No.,Topic Name,Q.No,Question,Q.Image,A,A.Image,B,B.Image,C,C.Image,D,D.Image,Answer
1,1,Alertness,1,What should you do before making a U-turn?,No,Give an arm signal as well as using your indicators,No,Check road markings to see that U-turns are permitted,No,Look over your shoulder for a final check,No,Select a higher gear than normal,No,C
2,1,Alertness,2,What should you do as you approach this bridge?,Yes,Move to the right,No,Slow down,No,Change gear,No,Keep to 30 mph,No,B
3,1,Alertness,3,Where should you avoid overtaking?,No,Just after a bend,No,In a one-way street,No,On a 30 mph road,No,Approaching a dip in the road,No,D
4,1,Alertness,4,What does this curved arrow road marking mean?,Yes,Heavy vehicles should take the next road on the left to avoid a weight limit,No,The road ahead bends to the left,No,Overtaking traffic should move back to the left,No,The road ahead has a camber to the left,No,C
5,1,Alertness,5,What should you do if your mobile phone rings while you're driving or riding?,No,Stop immediately,No,Answer it immediately,No,Leave it until you have stopped in a safe place,No,Pull up at the nearest kerb,No,C
6,1,Alertness,6,Why are these yellow lines painted across the road?,Yes,To help you choose the correct lane,No,To help you keep the correct separation distance,No,To make you aware of your speed,No,To tell you the distance to the roundabout,No,C
7,1,Alertness,7,What should you do when you're approaching traffic lights that have been green for some time?,No,Accelerate hard,No,Maintain your speed,No,Be ready to stop,No,Brake hard,No,C
8,1,Alertness,8,What should you do before slowing down or stopping your vehicle?,No,Sound the horn,No,Use the mirrors,No,Select a higher gear,No,Flash the headlights,No,B
9,1,Alertness,9,You're following a large vehicle. Why should you stay a safe distance behind it?,No,You'll be able to corner more quicky,No,You'll help the large vehicle to stop more easily,No,You'll give the drvier a chance to see you in their morrors,No,You'll keep out of the wind better,No,C
10,1,Alertness,10,Why should you use your mirrors when you see a hazard ahead?,No,Because you'll need to accelerate out of danger,No,To assess how your actions will affect the traffic behind,No,Because you'll need to brake sharply and stop,No,To check what's happening on the road ahead,No,B
11,1,Alertness,11,You're waiting to turn right at the end of a road. What should you do if your view is obstructed by parked vehicles?,No,Stop and then move forward slowly and carefully for a clear view,No,Move quickly to where you can see so you only block traffic from one direction,No,Wait for a pedestrian to let you know when it's safe for you to emerge,No,Turn your vehicle around immediately and find another junction to use,No,A
12,1,Alertness,12,There are objects hanging from your interior mirror. Why could this be a hazard?,No,Your view could be obstructed,No,Your sun visor might get tangled,No,Your radio reception might be affected,No,Your windscreen could mist up more easily,No,A
13,1,Alertness,13,You're on a long motorway journey. What should you do if you start to feel sleepy?,No,Play some loud music,No,Stop on the hard shoulder for a rest,No,Drive faster to complete your journey sooner,No,Leave the motorway and stop in a safe place,No,D
14,1,Alertness,14,Why should you switch your headlights on when it first starts to get dark?,No,To make your dials easier to see,No,So others can see you more easily,No,So that you blend in with other drivers,No,Because the street lights are lit,No,B
15,1,Alertness,15,What's most likely to distract you while you're driving?,No,Using a mobile phone,No,Using the windscreen wipers,No,Using the demisters,No,Using the mirrors,No,A
16,1,Alertness,16,You're driving your car. When may you use a hand-held mobile phone?,No,When you're receiving a call,No,When you've parked safely,No,When you're drivng at less than 30 mph,No,When your car has automatic transmission,No,B
17,1,Alertness,17,You're driving on a wet road. What should you do if you have to stop your vehicle in an emergency,No,Apply the parking brake and footbrake together,No,Keep both hands on the steering wheel,No,Select reverse gear,No,Give an arm signal,No,B
18,1,Alertness,18,What should you do when you move off from behind a parked car?,No,Give a signal after moving off,No,Look around before moving off,No,Look around after moving off,No,Use the exterior mirrors only,No,B
19,1,Alertness,19,You're travelling along this road. How should you pass the cyclist?,Yes,Sound your horn as you pass,No,Keep close to them as you pass,No,Leave them plenty of room as you pass,No,Change down one gear before you pass,No,C
20,1,Alertness,20,When do windscreen pillars cause a serious obstrucion to your view?,No,When you're driving on a motorway,No,When you're driving on a dual carriageway,No,When you're approaching a one-way street,No,When you're approaching bends and junctions,No,D
21,1,Alertness,21,What should you do if you can't see clearly behind when you're reversing?,No,Open the window to look behind,No,Open the door to look behind,No,Look in the nearside mirror,No,Ask someone to guide you,No,D
22,1,Alertness,22,What does the term 'blind spot' mean?,No,An area covered by your right-hand mirror,No,An area not covered by your headlights,No,An area covered by your left-hand mirror,No,An area not visible to the driver,No,D
23,1,Alertness,23,What's likely to happen if you use a hands-free phone while you're driving,No,It will improve your safely,No,It will increase you concentration,No,It will reduce your view,No,It will divert your attention,No,D
24,1,Alertness,24,You're turning right onto a dual carriageway. What should you do before emerging?,No,"Stop, apply the parking brake and then select a low gear",No,Position your vehicle well to the left of the side road,No,Check that the central reservation is wide enough for your vehicle,No,Make sure that you leave enough room for a vehicle behind,No,C
25,1,Alertness,25,You're wwaiting to emerge from a junction. The windscreen pillar is restricting your view. What should you be particularly aware of?,Yes,Lorries,No,Buses,No,Motorcyclists,No,Coaches,No,C
26,1,Alertness,26,How can you make sure that a satellite navigation (satnav) system doesn't distract you when you're driving?,No,Turn it off while you're driving in built-up areas,No,Choose a voice that you find calming,No,Only set the destination when you're lost,No,Set it before starting your journey,No,D
27,2,Attitude,1,What must you do when the amber light is flashing at a pelican crossing?,no,Stop and wait for the green light,no,Stop and wait for the red light,no,Give way to pedestrians waiting to cross,no,Give way to pedestrians already on the crossing,no,D
28,2,Attitude,2,Why should you never wave people across at pedestrian crossings?,no,Another vehicle may be coming,no,They may not be looking,no,It's safer for you to carry on,no,They may not be ready to cross,no,A
29,2,Attitude,3,Why is it dangerous to drive too close to the vehicle ahead?,no,Your engine will overheat,no,Your mirrors will need adjusting,no,Your view of the road ahead will be restricted,no,Your satnav will be confused,no,C
30,2,Attitude,4,What will happen if you follow this vehicle too closely?,yes,Your brakes will overheat.,no,Your fuel consumption will be increased.,no,Your engine will overheat.,no,Your view ahead will be reduced.,no,D
31,2,Attitude,5,What's the minimum time gap you should leave when following a vehicle on a wet road?,no,One second,no,Two seconds,no,Three seconds,no,Four seconds,no,D
32,2,Attitude,6,"You're being overtaken by a long, heavily laden lorry. What should you do if it's taking a long time for it to overtake?",no,Speed up,no,Slow down,no,Hold your speed,no,Change direction,no,B
33,2,Attitude,7,Which vehicle will use a blue flashing beacon?,no,Motorway maintenance ,no,Bomb disposal ,no,Snow plough,no,Breakdown recovery ,no,B
34,2,Attitude,8,What should you do if you're being followed by an ambulance showing flashing blue light?,no,Pull over as soon as it's safe to do so,no,Accelerate hard to get away from it,no,Maintain your speed and course,no,Brake harshly and stop well out into the road,no,A
35,2,Attitude,9,What type of emergency vehicle is fitted with a green flashing beacon?,no,Fire engine,no,Road gritter,no,Ambulance,no,Doctor's car,no,D
36,2,Attitude,10,Who should obey diamond-shaped traffic signs?,yes,Tram drivers,no,Bus drivers,no,Lorry drivers,no,Taxi drivers,no,A
37,2,Attitude,11,"On a road where trams operate, which vehicles will be most at risk from the tram rails?",no,Cars,no,Cycles,no,Buses,no,Lorries,no,B
38,2,Attitude,12,When should you use your vehicle's horn?,no,To alert others to your presence,no,To allow you right of way,no,To greet other road users,no,To signal your annoyance,no,A
39,2,Attitude,13,You're in a one-way street and want to turn right. Where should you position your vehicle when there are two lanes?,no,In the right-hand lane,no,In the left-hand lane,no,"In either lane, depending on the traffic",no,Just left of the centre line,no,A
40,2,Attitude,14,You wish to turn right ahead. Why should you take up the correct position in good time?,no,To allow other drivers to pull out in front of you,no,To give a better view into the road that you're joining,no,To help other road users know what you intend to do,no,To allow drivers to pass you on the right,no,C
41,2,Attitude,15,Which type of crossing allows cyclists to ride across while pedestrians are also crossing?,no,Toucan,no,Puffin,no,Pelican,no,Zebra,no,A
42,2,Attitude,16,"You're travelling at the legal speed limit. What should you do if the vehicle behind approaches quickly, flashing its headlights?",no,Accelerate to make a gap behind you,no,Touch the brakes sharply to show your brake lights,no,Maintain your speed to prevent the vehicle from overtaking,no,Allow the vehicle to overtake,no,D
43,2,Attitude,17,When should you flash your headlights at other road users?,no,When showing that you're giving way,no,When showing that you're about to turn,no,When telling them that you have right of way,no,When letting them know that you're there,no,D
44,2,Attitude,18,You're approaching an unmarked crossroads. How should you deal with the junction?,no,Accelerate and keep to the middle,no,Slow down and keep to the right  ,no,Accelerate and look to the left,no,Slow down and look both ways ,no,D
45,2,Attitude,19,The conditions are good and dry. When should you use the 'two-second rule'?,no,Before restarting the engine after it has stalled,no,When checking your gap from the vehicle in front,no,Before using the 'Mirrors - Signal - Manoeuvre' routine,no,When traffic lights change to green,no,A
46,2,Attitude,20,Which colour follows the green signal at a puffin crossing?,no,Steady red,no,Flashing amber,no,Steady amber,no,Flashing green,no,C
47,2,Attitude,21,You're in a line of traffic. What action should you take if the driver behind is following very closely?,no,Ignore the driver behind and continue to travel within the speed limit,no,"Slow down, gradually increasing the gap between you and the vehicle in front",no,Signal left and wave the driver behind to come past,no,Move over to a position just left of the centre line of the road,no,B
48,2,Attitude,22,You're driving on a clear night. Which lights should you use if the national speed limit applies and there's a steady stream of oncoming traffic?,no,Full-beam headlights,no,Sidelights,no,Dipped headlights,no,Fog lights,no,C
49,2,Attitude,23,You're driving behind a large goods vehicle. What should you do if it signals left but steers to the right?,no,Slow down and left the vehicle turn,no,"Drive on, keeping to the left",no,Overtake on the right of it,no,Hold your speed and sound your horn,no,A
50,2,Attitude,24,You're driving along this road. What should you do if the red car cuts in close in front of you?,yes,Accelerate to get closer to the red car,no,Give a long blast on the horn,no,Drop back to leave the correct separation distance,no,Flash your headlights several times,no,C
51,2,Attitude,25,You're waiting in a traffic queue at night. How can you avoid dazzling drivers behind you?,no,Use the parking brake and release the footbrake,no,Keep your foot on the footbrake,no,Balance the clutch with the accelerator,no,Use the parking brake and footbrake together,no,A
52,2,Attitude,26,You're driving in traffic at the speed limit for the road. What should you do if the driver behind is trying to overtake?,no,"Move loser to the car ahead, so the driver behind has no room to overtake",no,Wave the driver behind to overtake when it's safe.,no,Keep a steady course and allow the driver behind to overtake,no,Accelerate to get away from the driver behind.,no,C
53,2,Attitude,27,What does it mean if the signs at a bus lane show no times of operation?,yes,The lane isn't in operation.,no,The lane is only in operation at peak times.,no,The lane is in operation 24 hours a day.,no,The lane is only in operation in daylight hours.,no,C
54,2,Attitude,28,What should you do when a person herding sheep asks you to stop?,no,Ignore them as they have no authority,no,Stop and switch off your engine,no,Continue on but drive slowly,no,Try to get past quickly,no,B
55,2,Attitude,29,What should you do when you're overtaking a horse and rider?,no,Sound your horn as a warning,no,Go past as quickly as possible,no,Flash your headlights as a warning,no,Go past slowly and carefully,no,D
56,2,Attitude,30,You're approaching a zebra crossing. WHat should you do if pedestrians are waiting to cross?,no,Give way to older and infirm people only,no,Slow down and prepare to stop,no,Use your headlights to indicate they can cross,no,Wave at them to cross the road,no,B
57,2,Attitude,31,What should you do if a vehicle pulls out in front of you at a junction?,no,Swerve past it and sound your horn,no,Flash your headlights and drive up close behind,no,Slow down and be ready to stop,no,Accelerate past it immediately,no,C
58,2,Attitude,32,You're approaching a red light at a puffin crossing. Pedestrians are on the crossing. When will the red light change?,no,When you start to edge forward onto the crossing,no,When the pedestrians have cleared the crossing,no,When the pedestrians push the button on the far side of the crossing,no,When a driver from the opposite direction reaches the crossing,no,B
59,2,Attitude,33,Which instrument-panel warning light would show that headlights are on main beam?,no,,yes,,yes,,yes,,yes,A
60,2,Attitude,34,When should you leave a two-second gap between your vehicle and the one in front?,yes,When it's raining,no,When it's dry,no,When it's icy,no,When it's foggy,no,B
61,2,Attitude,35,You're driving at night on an unlit road. What should you do if you're following another vehicle?,no,Flash your headlights,no,Use dipped headlights,no,Switch off your headlights,no,Use full-beam headlights,no,B
62,2,Attitude,36,What should you do if you're driving a slow-moving vehicle on a narrow winding road?,no,Keep well out to stop vehicles overtaking dangerously,no,Wave the vehicles behind to come past you if you think they can overtake quickly,no,"Pull in when you can, to let the vehicles behind overtake",no,Give a left signal when it's safe for vehicles to overtake you,no,C
63,2,Attitude,37,You're driving a car that has a diesel engine. What can a loose filler cap on your fuel tank cause?,no,It can make the engine difficult to start,no,It can make the roads slippery for other road users,no,It can improve your vehicle's fuel consumption,no,It can increase the level of exhaust emissions,no,B
64,2,Attitude,38,What should you do to avoid fuel spillage?,no,Check that your tank is only three-quarters full,no,Check that you've used a locking filler cap,no,Check that your fuel gauge is working,no,Check that your filler cap is securely fastened,no,D
65,2,Attitude,39,What style of driving causes increased risk to everyone?,no,Considerate,no,Defensive,no,Competitive,no,Responsible,no,C
66,3,Safety and your vehicle,1,How would under-inflated tyres affect your vehicle?,no,The vehicle's stopping distance would increase,no,The flash rate of the vehicle's indicators would increase,no,The vehicle's gear change mechanism would become stiff,no,The vehicle's headlights would aim high,no,A
67,3,Safety and your vehicle,2,When are you not allowed to sound your vehicle's horn?,no,Between 10.00 pm and 6.00 am in a built-up area,no,At any time in a built-up area,no,Between 11.30 pm and 7.00 am in a built-p area,no,Between 11.30 pm and 6.00 am on any road,no,C
68,3,Safety and your vehicle,3,What makes the vehicle in the picture 'environmentally friendly'?,yes,It's powered by gravity,no,It's powered by diesel,no,It's powered by electricity,no,It's powered by unleaded petrol ,no,C
69,3,Safety and your vehicle,4,Why have 'red routes' been introduced in major cities?,no,To raise the speed limits,no,To help the traffic flow,no,To provide better parking,no,To allow lorries to load more freely,no,B
70,3,Safety and your vehicle,5,"What's the purpose of road humps, chicanes and narrowings?",no,To separate lanes of traffic,no,To increase traffic speed,no,To allow pedestrians to cross,no,To reduce traffic speed,no,A
71,3,Safety and your vehicle,6,What's the purpose of a catalytic converter?,no,To reduce fuel consumption,no,To reduce the risk of fire,no,To reduce harmful exhaust gases,no,To reduce engine wear,no,C
72,3,Safety and your vehicle,7,When should tyre pressures be checked?,no,After any lengthy journey,no,After travelling at high speed,no,When tyres are hot,no,When tyres are cold,no,D
73,3,Safety and your vehicle,8,When will your vehicle use more fuel?,no,When its tyres are under-inflated,no,When its tyres are of different makes,no,When its tyres are over-inflated,no,When its tyres are new,no,A
74,3,Safety and your vehicle,9,How should you dispose of a used vehicle battery?,no,Bury it in your garden.,no,Put it in the dustbin.,no,Take it to a local-authority disposal site.,no,Leave it on waste land.,no,C
75,3,Safety and your vehicle,10,What's most likely to increase fuel consumption?,no,Poor steering control,no,Accelerating around bends,no,Staying in high gears,no,Harsh braking and accelerating,no,D
76,3,Safety and your vehicle,11,The fluid level in your battery is low. What fluid should you use to top it up?,no,Battery acid,no,Distilled water,no,Engine oil,no,Engine coolant,no,B
77,3,Safety and your vehicle,12,You're parked on the road at night. When must you use parking lights?,no,When there are continuous white lines in the middle of the road,no,When the speed limit exceeds 30 mph,no,When you're facing oncoming traffic,no,When you're near a bus stop,no,B
78,3,Safety and your vehicle,13,How can you reduce the environmental harm caused by your motor vehicle?,no,Only use it for short journeys,no,Don't service it,no,Drive faster than normal,no,Keep engine revs low,no,D
79,3,Safety and your vehicle,14,What can cause excessive or uneven tyre wear?,no,A faulty gearbox,no,A faulty braking system,no,A faulty electrical system,no,A faulty exhaust system,no,B
80,3,Safety and your vehicle,15,You need to top up your battery with distilled water. What level should you fill it to?,no,The top of the battery,no,Halfway up the battery,no,Just below the cell plates,no,Just above the cell plates,no,D
81,3,Safety and your vehicle,16,How can you plan your route before starting a long journey?,no,Check your vehicle handbook.,no,Ask your local garage.,no,Use a route planner on the internet.,no,Consult a travel agent.,no,C
82,3,Safety and your vehicle,17,Why is it a good idea to plan your journey to avoid busy times?,no,You'll have an easier journey.,no,You'll have a more stressful journey.,no,Your journey time will be longer.,no,It will cause more traffic congestion.,no,A
83,3,Safety and your vehicle,18,How will your journey be affected by travelling outside the busy times of day?,no,Your journey will use more fuel,no,Your journey will take longer,no,Your journey will be more hazardous,no,Your journey will have fewer delays. ,no,D
84,3,Safety and your vehicle,19,You plan your route before starting a journey. Why should you also plan an alternative route?,no,Your original route may be blocked,no,Your maps may have different scales,no,You may find you hvae to pay a congestion charge,no,You may get held up by a tractor,no,A
85,3,Safety and your vehicle,20,You have to arrive on time for an appointment. How shoud you plan for the journey?,no,Allow plenty of time for the trip.,no,Plan to travel at busy times.,no,Avoid roads with the national speed limit.,no,Prevent other drivers from overtaking.,no,A
86,3,Safety and your vehicle,21,What can you expect if you drive using rapid acceleration and heavy braking?,no,Reduced pollution,no,Increased fuel consumption,no,Reduced exhaust emissions,no,Increased road safety,no,B
87,3,Safety and your vehicle,22,What could cause you to crash if the level is allowed to get too low?,no,Anti-freeze level,no,Brake-fluid level,no,Battery-water level,no,Radiator-coolant level,no,B
88,3,Safety and your vehicle,23,What should you do if your anti-lock brakes (ABS) warning light stays on?,no,Check the brake-fluid level.,no,Check the footbrake free play.,no,Check that the parking brake is released.,no,Have the brakes checked immediately.,no,D
89,3,Safety and your vehicle,24,What does it mean if this light comes on while you're driving?,yes,A fault in the braking system,no,The engine oil is low,no,A rear light has failed,no,Your seat belt isn't fastened,no,A
90,3,Safety and your vehicle,25,Why is it important to wear suitable shoes when you're driving?,no,To prevent wear on the pedals,no,To maintain control of the pedals ,no,To enable you to adjust your seat,no,To enable you to walk for assistance if you break down,no,B
91,3,Safety and your vehicle,26,"If you're involved in a collision, what will reduce the risk of neck injury?",no,An air-sprung seat,no,Anti-lock brakes,no,A collapsible steering wheel,no,A properly adjusted head restraint,no,D
92,3,Safety and your vehicle,27,What does it mean if your vehicle keeps bouncing after you sharply press down and release on the bodywork over a wheel?,no,The tyres are worn,no,The tyres are under inflated,no,The vehicle is on soft ground ,no,The shock absorbers are worn ,no,D
93,3,Safety and your vehicle,28,How will a roof rack affect your car?,no,There will be less wind noise,no,The engine will use more oil,no,The car will accelerate faster,no,Fuel consumption will increase,no,D
94,3,Safety and your vehicle,29,What makes your tyres illegal?,no,"If they have any large, deep cuts in the side wall",no,If they're of different makes,no,If they have different tread patterns,no,Default Answer D,no,B
95,3,Safety and your vehicle,30,What's the legal minimum depth of tread for car tyres?,no,1 mm,no,1.6 mm,no,2.5 mm,no,4 mm,no,B
96,3,Safety and your vehicle,31,You're carrying two 13-year-old children and their parents in your car. Who's responsible for seeing that the children wear seat belts?,no,The children's parents,no,"You, the driver",no,The front-seat passenger,no,The children,no,B
97,3,Safety and your vehicle,32,How can drivers help the environment?,no,By accelerating harshly,no,By accelerating gently,no,By using leaded gently,no,By riving faster,no,B
98,3,Safety and your vehicle,33,How can you avoid wasting fuel?,no,By having your vehicle serviced regularly,no,By revving the engine in the lower gears,no,By keeping an empty roof rack on your vehicle,no,By driving at higher speeds where possible,no,A
99,3,Safety and your vehicle,34,What could you do to reduce the volume of traffic on the roads?,no,Drive in a bus lane,no,Use a car with a smaller engine,no,Walk or cycle on short journeys,no,Travel by car at all times,no,C
100,3,Safety and your vehicle,35,What's most likely to waste fuel?,no,Reducing your speed,no,Driving on motorways,no,Using different brands of fuel ,no,Under-inflated tyres,no,D
101,3,Safety and your vehicle,36,What part of the car does the law require you to keep in good condition?,no,The gearbox,no,The transmission,no,The door locks,no,The seat belts,no,D
102,3,Safety and your vehicle,37,"How much more fuel will you use by driving at 70 mph, compared with driving at 50 mph?",no,About 5%,no,About 15%,no,About 75%,no,About 100%,no,B
103,3,Safety and your vehicle,38,What should you do if your vehicle pulls to one side when you use the brakes?,no,Increase the pressure in your tyres.,no,Have the brakes checked as soon as possible.,no,Change gear and pump the brake pedal.,no,Use your parking brake at the same time.,no,B
104,3,Safety and your vehicle,39,What will happen if your car's wheels are unbalanced?,no,The steering will pull to one side,no,The steering will vibrate,no,The brakes will fail,no,The tyres will deflate,no,B
105,3,Safety and your vehicle,40,What can be damaged if you turn the steering wheel when the car isn't moving?,no,The gearbox,no,The engine,no,The brakes,no,The tyres,no,D
106,3,Safety and your vehicle,41,What's the safest thing to do if you have to leave valuables in your car?,no,Put them in a carrier bag,no,Park near a school entrance,no,Lock them out of sight,no,Park near a bus stop,no,C
107,3,Safety and your vehicle,42,What may help to deter a thief from stealing your car?,no,Always keeping the headlights on,no,Fitting reflective glass windows,no,Always keeping the interior light on,no,Etching the registration number on the windows,no,D
108,3,Safety and your vehicle,43,What should you remove from your car before leaving it unattended?,no,The car dealer's details,no,The owner's manual,no,The service record,no,The vehicle registration document,no,D
